originals	paraphrase_1	paraphrase_2	paraphrase_3	paraphrase_4
The authors developed a supervised classification system using syntactic and semantic features from WordNet, and they used SVM as a classification algorithm.	A supervised classification system was developed by the authors, incorporating syntactic and semantic features derived from WordNet, with SVM serving as the classification algorithm.	Using SVM as their classification algorithm, the authors created a supervised classification system that utilized syntactic and semantic features extracted from WordNet.	The researchers constructed a supervised classification framework that employed syntactic and semantic features sourced from WordNet, implementing SVM for classification purposes.	Through the use of syntactic and semantic features obtained from WordNet, the authors built a supervised classification system where SVM functioned as the classification algorithm.
The drawback of the method is its reduced flexibility, because it is only defined for a specific causal construction and its confidence in syntactic features.	Reduced flexibility constitutes the method's disadvantage, as it operates exclusively within a single causal construction while depending heavily on syntactic features.			
Moreover, the authors conclude that semantic features are more adequate for causality classification than syntactic features, which goes in the direction of our claim.	The authors further determine that causality classification benefits more from semantic features than syntactic ones, supporting our assertion.	Additionally, the authors reach the conclusion that semantic features prove superior to syntactic features for causality classification, aligning with our position.	Furthermore, the authors establish that semantic features demonstrate greater suitability for causality classification compared to syntactic features, reinforcing our argument.	The authors also find that causality classification is better served by semantic features rather than syntactic features, which supports our contention.
The first attempt of encoding the contextual information for causality classification between events is found in Do et al.	Do et al. represents the initial effort to encode contextual information for classifying causal relationships between events.	In Do et al., we find the earliest approach to incorporating contextual information into causality classification systems for events.	The pioneering work on encoding contextual information to classify causality between events can be traced back to Do et al.	Do et al. marks the beginning of attempts to capture contextual information for the purpose of event causality classification.
(2011).				
The authors defined a measure of the causality relation between two events according to the co-occurrence frequency between the predicates and their arguments.	A causality relation measure between two events was established by the authors based on how frequently predicates and their arguments co-occur.	According to the co-occurrence frequency of predicates and their arguments, the authors created a metric for measuring causality relations between two events.	The co-occurrence frequency between predicates and their arguments served as the basis for the authors' definition of a causality relation measure between two events.	By examining how often predicates and their arguments appear together, the authors formulated a measure for causality relations between two events.
The measure is inspired by the causality score defined by Riaz and Girju (2010).				
Following the work of Do et al.	In accordance with the findings of Do et al.	As established in the research of Do et al.	In line with the approach taken by Do et al.	
(2011), Riaz and Girju (2013, 2014) built a knowledge base for causal events, first for events related by a pair of verbs, and then for events conveyed by pairs of verbs and noun phrases.				
In these works, the authors attempted to go in the direction of using distributional semantics in order to encode the causal meaning, but they still rely on the use of lexical and syntactic features.	These studies saw authors trying to leverage distributional semantics for encoding causal meaning, yet they continued to depend on lexical and syntactic features.	The researchers in these publications sought to employ distributional semantics to capture causal meaning, while maintaining their reliance on lexical and syntactic features.	Authors of these works made efforts toward utilizing distributional semantics for causal meaning encoding, though lexical and syntactic features remained central to their approach.	Within these publications, there was an attempt by the authors to move toward distributional semantics for representing causal meaning, but lexical and syntactic features were still essential components.
Thus, the main drawbacks of those papers are the complex featuring engineering process to detect the causal relation, and the restricted coverage of the resulting knowledge bases.				
Following the previous approaches, Mirza and Tonelli (2016) described a causal classification system built upon a rule based system and a machine learning algorithm based on lexical, syntactic and semantic features.	Building on earlier methodologies, Mirza and Tonelli (2016) presented a causal classification system that combined a rule based system with a machine learning algorithm utilizing lexical, syntactic and semantic features.	In line with prior work, a causal classification system was described by Mirza and Tonelli (2016), which integrated both a rule based system and a machine learning algorithm that employed lexical, syntactic and semantic features.	Mirza and Tonelli (2016) outlined a causal classification system that built upon a rule based system alongside a machine learning algorithm incorporating lexical, syntactic and semantic features, continuing from previous methodological approaches.	Adopting the framework of earlier studies, Mirza and Tonelli (2016) developed a causal classification system through the combination of a rule based system and a machine learning algorithm that leveraged lexical, syntactic and semantic features.
The novelty lies in the use of features of temporal relations.	Features of temporal relations provide the novel contribution here.			
The work of Mirza and Tonelli (2016) has similar issues to the work of (Bethard and Martin, 2008), because they use similar features to represent causality.				
"3
Sentence Type
(Cathay Pacific delayed both legs of its quadruple daily Hong Kong to London route)e1 ([due to]l this disruption in air traffic services."				
)e2 Explicit (The factory was not well equipped to handle the gas)e1 (created by the sudden addition of water to the MIC tank.				
")e2 Implicit
Table 1: Explicit and implicit causal relations
The previous works support the idea that causality is defined by a specific syntactic construction or the semantics of verbs known as causative verbs."				
On the other hand, some of the works restricted their study to a narrow kind of syntactic constructions, such as the conjoined events of Bethard and Martin (2008).	Conversely, certain studies limited their investigations to specific types of syntactic structures, including the conjoined events examined by Bethard and Martin (2008).	However, a number of these studies confined their research to particular syntactic construction categories, like the conjoined events that Bethard and Martin (2008) analyzed.	In contrast, several works focused exclusively on limited varieties of syntactic patterns, exemplified by Bethard and Martin's (2008) work on conjoined events.	Alternatively, certain research efforts constrained their scope to specialized syntactic construction types, as demonstrated in Bethard and Martin's (2008) study of conjoined events.
In contrast, we argue that the representation of causality should not be limited by syntactic patterns or the coverage of semantic resources, due to the lack of a particular linguistic construction for causality.	We contend, however, that causality representation ought not be constrained by syntactic patterns or semantic resource coverage, given the absence of a specific linguistic construction for causality.	Conversely, our position is that representing causality should transcend the limitations imposed by syntactic patterns and semantic resource scope, since causality lacks a dedicated linguistic construction.	On the contrary, we maintain that causality's representation must not be restricted to what syntactic patterns or semantic resources can cover, precisely because causality has no particular linguistic construction.	We propose instead that the way causality is represented should extend beyond syntactic pattern boundaries and semantic resource limitations, as causality does not possess a specific linguistic construction.
Therefore, we propose the neural encoding of the context of the relation in order to disambiguate its causal meaning.	To disambiguate its causal meaning, we thus suggest employing neural encoding for the relation's context.	We consequently put forward neural encoding of relational context as a method for disambiguating causal meaning.	Neural encoding of the relation's context is what we propose as a solution for disambiguating its causal meaning.	For the purpose of disambiguating causal meaning, our proposal involves neural encoding of the contextual information surrounding the relation.
The next sections expose the definition of the task (Section 3.1), the data used in the experiments (Section 3.2) and the proposed system (Section 3.3).				
Causality is defined as the semantic relation between two events (e1, e2), namely causing event (cause, e1) and caused event (effect, e2).				
An event may be a verb, whose arguments may be explicitly present or not (subject, verb, object), or a noun phrase.				
The relation can be explicit or implicit, in case it is explicitly expressed, it is signalled by a lexical marker (l), which may be a verb, a preposition, an adverb or an expression such as as a result of, see Table 1.				
Some researchers impose two additional restrictions: the temporal restriction, which means that the causing event should take place before the caused event, and the counterfactual one, which says if the causing event did not occur, the caused event would not have occurred either.	Two additional restrictions are imposed by some researchers: first, the temporal restriction requiring the causing event to precede the caused event, and second, the counterfactual restriction stating that without the causing event, the caused event would also not have taken place.	Certain researchers apply two further constraints: the temporal restriction demands that causing events must happen prior to caused events, while the counterfactual restriction asserts that caused events would be absent if their causing events had not occurred.	Additional restrictions are established by some researchers, including the temporal restriction whereby causing events must occur before caused events, and the counterfactual restriction whereby the absence of a causing event would result in the absence of the caused event.	Among some researchers, two extra restrictions are implemented: the temporal restriction ensures causing events happen before caused events, and the counterfactual restriction maintains that without causing events, their corresponding caused events would not exist.
Thus, causation can be formally defined as e1 → e2.				
"An example from the test set used in the experiments that follows the three restrictions is the following:
A government affidavit in 2006 stated that (the leak)e1 (caused 558,125 injuries, including 38,478 temporary partial injuries and approximately 3,900 severely and permanently disabling injuries)e2
It is evident that e1 is before e2 and if the leak did not occur, the set of events in e2 would not occur."				
Nevertheless, we support the same opinion as Neeleman and van de Koot (2012) and we do not add the counterfactual constraint in our definition, because it is not true in all the cases.	However, we align with the perspective of Neeleman and van de Koot (2012) and choose not to incorporate the counterfactual constraint into our definition, since it does not hold universally.	We share the view expressed by Neeleman and van de Koot (2012) and therefore exclude the counterfactual constraint from our definition, as it fails to apply in every instance.	In agreement with Neeleman and van de Koot (2012), we refrain from including the counterfactual constraint in our definition, given that it lacks universal validity.	Like Neeleman and van de Koot (2012), we maintain the position that the counterfactual constraint should be omitted from our definition, as it cannot be applied across all scenarios.
"For example:
(The argument between John’s parents)e1 (broke the window)e2
If we follow the counterfactual constraint, the event of the argument between the John’s parents should be the causing event."				
However, the human mental model of causality does not usually relate an argument with the breaking of a window.	Nevertheless, people typically don't connect an argument to a window breaking in their mental model of causality.	The way humans mentally conceptualize causality, though, doesn't normally link an argument to the breaking of a window.	Yet in the human cognitive framework for understanding causality, an argument isn't commonly associated with the breaking of a window.	Still, when humans think about causal relationships, they don't ordinarily tie an argument to a window breaking.
Causation is concerned with the human understanding of the world and not with the world itself.	The focus of causation lies in how humans comprehend the world rather than in the world's inherent nature.	Human comprehension of the world, not the world as it exists independently, is what causation addresses.	What causation deals with is our human interpretation of the world, not the world in its own right.	Rather than engaging with the world directly, causation engages with humanity's perception of that world.
Concerning the temporal restriction, it should be interpreted as a physical ordering constraint and not as a positional one.	Regarding the temporal restriction, it ought to be understood as a constraint on physical ordering rather than positional ordering.	The temporal restriction should be viewed as imposing a physical ordering constraint instead of a positional constraint.	As for the temporal restriction, one must interpret it as a constraint governing physical ordering, not positional ordering.	With respect to the temporal restriction, the proper interpretation involves treating it as a physical ordering constraint rather than one that is positional.
That means, the causing event does not always appear before the caused event in the sentence.	This indicates that the caused event may precede the causing event within the sentence structure.	Put differently, within sentence boundaries, the caused event can appear before its corresponding causing event.		
"The caused event (e2) is before the causing event (e1) in the following example:
(This water was diverted)e2 ([due to]l a combination of improper maintenance, leaking and clogging, and eventually ended up in the MIC storage tank."				
")e1
Some related work attempted to identify the causing, the caused event and its direction (Mirza and Tonelli, 2016), but for that purpose, they restricted the study to a specific syntactic construction."				
We claim that the task of causality classification has not to be restricted to a syntactic construction and it has to be set up as a two steps task: causal meaning classification and causal arguments identification.	Our assertion is that causality classification should not be limited to syntactic construction alone, but rather structured as a dual-phase process: first classifying causal meaning, then identifying causal arguments.	It is our position that the causality classification task must extend beyond syntactic construction constraints and be organized into two distinct steps: causal meaning classification and causal arguments identification.	We argue that causality classification cannot be confined to syntactic construction and must be approached through a two-stage methodology: the classification of causal meaning followed by the identification of causal arguments.	The causality classification task, we contend, should not be bound by syntactic construction limitations and requires implementation as a bifurcated approach: causal meaning classification and causal arguments identification.
The task of causal meaning classification is a binary classification task that is defined as the disambiguation of the causal meaning of the relation of two events.	Causal meaning classification constitutes a binary classification task involving the disambiguation of how two events are causally related.	As a binary classification task, causal meaning classification involves disambiguating the causal relationship that exists between two events.	The disambiguation of causal relationships between pairs of events defines the binary classification task known as causal meaning classification.	Binary classification of causal meaning focuses on disambiguating the nature of causal relations that connect two events.
The input of the task is two events and the output is the meaning of the relation (Causal or Non Causal).	Two events serve as the task's input, while the relation's meaning (Causal or Non Causal) constitutes the output.	This task takes two events as input and produces the relational meaning (Causal or Non Causal) as its output.	The task receives two events and yields the meaning of their relationship (Causal or Non Causal).	Given two events as input, the task generates the meaning of how they relate (Causal or Non Causal).
The task of causal argument identification is focused on the identification of the causing (e1) and caused (e2) events.				
The aim of this paper is to contribute to the first subtask, so given two events (e1, e2) and the expression susceptible of signalling causality (l), the system returns the meaning of the relation (Causal or Non Causal).				
The following sentence is an example of the input of our system.	Our system receives input like the sentence that follows.	What follows serves as an example of input to our system.	The sentence below demonstrates the type of input our system processes.	This sentence exemplifies what our system takes as input.
"(He fell in love with her and changed his life)e1 ([so]l he could help her)e2
4
Sentence Meaning
An undercroft is traditionally a cellar or storage room, often brick-lined and vaulted, and used for storage in buildings since medieval times
Temporal
Additionally if one is to use a large scan range then sensitivity of the instrument is decreased due to performing fewer scans per second since each scan will have to detect a wide range of mass fragments
Causal
In stark contrast to his predecessor, five days after his election he spoke of his determination to do what he could to bring peace Temporal Bischoff in a round table discussion claimed he fired Austin after he refused to do a taping in Atlanta Causal
Table 2: Examples of different meanings of the prepositions since and after taken from the AltLex corpus"				
Causality may be signalled by a verb (cause), a preposition (because), an adverb (subsequently) or an expression such as as a result of.				
Some of those causal expressions are almost unambiguous, but the causal meaning of others totally depends on the context.	While certain causal expressions are nearly unambiguous, others derive their causal meaning entirely from context.	A few causal expressions carry almost clear meanings, yet for others, context completely determines their causal interpretation.	Among causal expressions, some are virtually unambiguous, but others require context to establish any causal meaning whatsoever.	Context plays no role in interpreting some causal expressions that are almost unambiguous, while it completely governs the causal meaning of others.
For instance, according to PDTB, the preposition because is an unambiguous lexical marker of causation, but there are other expressions whose causal meaning is not unarguable, such as since or after that may have a temporal or a causal interpretation, see Table 2.	One can observe in PDTB that because represents an unquestionable lexical indicator of causation, but expressions like since or after have disputable causal meanings that permit temporal or causal understanding, see Table 2.			
Therefore, we need a corpus in which the events, the lexical marker and the meaning of the relation are annotated.	Hence, a corpus is required where the events, lexical marker, and relational meaning are all annotated.	We must have a corpus that contains annotations for the events, the lexical marker, and the relation's meaning.	A corpus with annotated events, lexical marker, and relational meaning is what we require.	It is necessary for us to obtain a corpus that has been annotated for events, the lexical marker, and the meaning of the relation.
To the best of our knowledge, there are three available corpora.	As far as we know, three corpora are currently available.	According to our understanding, there exist three accessible corpora.	From what we can determine, three corpora can be found.	Within our present understanding, three corpora have been made available.
The first one was exposed in Bethard and Martin (2008) and it is built on top of the Penn TreeBank corpus.	Bethard and Martin (2008) first exposed this one, which was constructed using the Penn TreeBank corpus as its foundation.	Built upon the Penn TreeBank corpus, the initial one was revealed by Bethard and Martin (2008).	The initial exposure of this one occurred in Bethard and Martin (2008), with its construction based on the Penn TreeBank corpus.	Using the Penn TreeBank corpus as a base, the first one was brought to light in Bethard and Martin (2008).
The corpus only provides the position of the related events in each sentence and whether the relation is causal.	Each sentence in the corpus contains only the locations of related events and indicates whether the relation is causal.	Within each sentence, the corpus specifies merely the positioning of related events and determines if the relation is causal.	For every sentence, the corpus supplies just the placement of related events along with information about whether the relation is causal.	The corpus furnishes, for each sentence, solely the location of related events and an indication of whether the relation is causal.
Unfortunately, the corpus is not freely available, and is also not large enough to train neural methods.	Two problems exist with the corpus: it cannot be obtained freely and is too small to effectively train neural methods.			
The second corpus is Causal-TimeBank (Mirza et al., 2014), which is built on top of the TimeML corpus.				
Annotation was restricted to explicit causal relations.	Only explicit causal relations were included in the annotation process.	The annotation process was limited to explicit causal relations alone.	Explicit causal relations were the sole focus of the annotation restrictions.	The scope of annotation encompassed only explicit causal relations.
They followed the same annotation schema of TimeML, so they defined the label CSIGNAL for the causal lexical markers, and CLINK to mark the causal relation between two events.	Using TimeML's annotation schema as their foundation, they established CSIGNAL as the label for causal lexical markers and CLINK to indicate causal relations connecting two events.	The same TimeML annotation schema was adopted by them, leading to their definition of CSIGNAL for marking causal lexical indicators and CLINK for representing causal relationships between event pairs.	By adhering to TimeML's identical annotation framework, CSIGNAL was designated for causal lexical markers while CLINK served to denote causal connections linking two events.	Their approach mirrored TimeML's annotation schema, which resulted in CSIGNAL being defined for causal lexical markers and CLINK for marking causal relationships that exist between two events.
The authors manually annotated the causal relations between the identified events in TimeML.	In TimeML, the authors provided manual annotations for the causal relations that exist between the events they had identified.	Manual annotation of causal relations between identified events was performed by the authors using TimeML.	Using TimeML, the authors carried out manual annotation to establish causal relations among the events that had been identified.	The identified events in TimeML were manually annotated by the authors to capture their causal relations.
The fact that the causal lexical markers are annotated agrees with our data requirements, but as the previous corpus, Causal-TimeBank is too small to train neural methods.	While the annotation of causal lexical markers in this corpus aligns with what we need for our data, Causal-TimeBank suffers from the same limitation as the earlier corpus—it lacks sufficient size for training neural methods.	Although having causal lexical markers annotated matches our data specifications, Causal-TimeBank shares the same drawback as the preceding corpus: inadequate scale for neural method training.	The annotation of causal lexical markers corresponds to our data needs, yet Causal-TimeBank, like the corpus mentioned before, remains too limited in scope for effective neural model training.	Despite the presence of annotated causal lexical markers meeting our data criteria, Causal-TimeBank exhibits the identical problem as the former corpus—insufficient volume for neural approach development.
